0,1,2
1628,9,"זִכְרוּ רִאשֹׁנוֹת מֵעוֹלָם כִּי אָנֹכִי אֵל וְאֵין עוֹד אֱלֹהִים וְאֶפֶס כָּמוֹנִי ׃"
1628,10,"מַגִּיד מֵרֵאשִׁית אַחֲרִית וּמִקֶּדֶם אֲשֶׁר לֹא־נַעֲשׂוּ אֹמֵר עֲצָתִי תָקוּם וְכָל־חֶפְצִי אֶעֱשֶׂה ׃"
1628,11,"קֹרֵא מִמִּזְרָח עַיִט מֵאֶרֶץ מֶרְחָק אִישׁ עֲצָתִו (עֲצָתִי) אַף־דִּבַּרְתִּי אַף־אֲבִיאֶנָּה יָצַרְתִּי אַף־אֶעֱשֶׂנָּה ׃"
1628,12,"שִׁמְעוּ אֵלַי אַבִּירֵי לֵב הָרְחוֹקִים מִצְּדָקָה ׃"
1628,13,"קֵרַבְתִּי צִדְקָתִי לֹא תִרְחָק וּתְשׁוּעָתִי לֹא תְאַחֵר וְנָתַתִּי בְצִיּוֹן תְּשׁוּעָה לְיִשְׂרָאֵל תִּפְאַרְתִּי ׃"
1629,1,"רְדִי וּשְׁבִי עַל־עָפָר בְּתוּלַת בַּת־בָּבֶל שְׁבִי־לָאָרֶץ אֵין־כִּסֵּא בַּת־כַּשְׂדִּים כִּי לֹא תוֹסִיפִי יִקְרְאוּ־לָךְ רַכָּה וַעֲנֻגָּה ׃"
1629,2,"קְחִי רֵחַיִם וְטַחֲנִי קָמַח גַּלִּי צַמָּתֵךְ חֶשְׂפִּי־שֹׁבֶל גַּלִּי־שׁוֹק עִבְרִי נְהָרוֹת ׃"
1629,3,"תִּגָּל עֶרְוָתֵךְ גַּם תֵּרָאֶה חֶרְפָּתֵךְ נָקָם אֶקָּח וְלֹא אֶפְגַּע אָדָם ׃"
1629,4,"גֹּאֲלֵנוּ יְהוָה צְבָאוֹת שְׁמוֹ קְדוֹשׁ יִשְׂרָאֵל ׃"
1629,5,"שְׁבִי דוּמָם וּבֹאִי בַחֹשֶׁךְ בַּת־כַּשְׂדִּים כִּי לֹא תוֹסִיפִי יִקְרְאוּ־לָךְ גְּבֶרֶת מַמְלָכוֹת ׃"
1629,6,"קָצַפְתִּי עַל־עַמִּי חִלַּלְתִּי נַחֲלָתִי וָאֶתְּנֵם בְּיָדֵךְ לֹא־שַׂמְתְּ לָהֶם רַחֲמִים עַל־זָקֵן הִכְבַּדְתְּ עֻלֵּךְ מְאֹד ׃"
1629,7,"וַתֹּאמְרִי לְעוֹלָם אֶהְיֶה גְבָרֶת עַד לֹא־שַׂמְתְּ אֵלֶּה עַל־לִבֵּךְ לֹא זָכַרְתְּ אַחֲרִיתָהּ ׃"
1629,8,"וְעַתָּה שִׁמְעִי־זֹאת עֲדִינָה הַיּוֹשֶׁבֶת לָבֶטַח הָאֹמְרָה בִּלְבָבָהּ אֲנִי וְאַפְסִי עוֹד לֹא אֵשֵׁב אַלְמָנָה וְלֹא אֵדַע שְׁכוֹל ׃"
1629,9,"וְתָבֹאנָה לָּךְ שְׁתֵּי־אֵלֶּה רֶגַע בְּיוֹם אֶחָד שְׁכוֹל וְאַלְמֹן כְּתֻמָּם בָּאוּ עָלַיִךְ בְּרֹב כְּשָׁפַיִךְ בְּעָצְמַת חֲבָרַיִךְ מְאֹד ׃"
1629,10,"וַתִּבְטְחִי בְרָעָתֵךְ אָמַרְתְּ אֵין רֹאָנִי חָכְמָתֵךְ וְדַעְתֵּךְ הִיא שׁוֹבְבָתֶךְ וַתֹּאמְרִי בְלִבֵּךְ אֲנִי וְאַפְסִי עוֹד ׃"
1629,11,"וּבָא עָלַיִךְ רָעָה לֹא תֵדְעִי שַׁחְרָהּ וְתִפֹּל עָלַיִךְ הֹוָה לֹא תוּכְלִי כַּפְּרָהּ וְתָבֹא עָלַיִךְ פִּתְאֹם שׁוֹאָה לֹא תֵדָעִי ׃"
1629,12,"עִמְדִי־נָא בַחֲבָרַיִךְ וּבְרֹב כְּשָׁפַיִךְ בַּאֲשֶׁר יָגַעַתְּ מִנְּעוּרָיִךְ אוּלַי תּוּכְלִי הוֹעִיל אוּלַי תַּעֲרוֹצִי ׃"
1629,13,"נִלְאֵית בְּרֹב עֲצָתָיִךְ יַעַמְדוּ־נָא וְיוֹשִׁיעֻךְ הֹבְרֵו (הֹבְרֵי) שָׁמַיִם הַחֹזִים בַּכּוֹכָבִים מוֹדִיעִם לֶחֳדָשִׁים מֵאֲשֶׁר יָבֹאוּ עָלָיִךְ ׃"
1629,14,"הִנֵּה הָיוּ כְקַשׁ אֵשׁ שְׂרָפָתַם לֹא־יַצִּילוּ אֶת־נַפְשָׁם מִיַּד לֶהָבָה אֵין־גַּחֶלֶת לַחְמָם אוּר לָשֶׁבֶת נֶגְדּוֹ ׃"
1629,15,"כֵּן הָיוּ־לָךְ אֲשֶׁר יָגָעַתְּ סֹחֲרַיִךְ מִנְּעוּרַיִךְ אִישׁ לְעֶבְרוֹ תָּעוּ אֵין מוֹשִׁיעֵךְ ׃"
1630,1,"שִׁמְעוּ־זֹאת בֵּית־יַעֲקֹב הַנִּקְרָאִים בְּשֵׁם יִשְׂרָאֵל וּמִמֵּי יְהוּדָה יָצָאוּ הַנִּשְׁבָּעִים בְּשֵׁם יְהוָה וּבֵאלֹהֵי יִשְׂרָאֵל יַזְכִּירוּ לֹא בֶאֱמֶת וְלֹא בִצְדָקָה ׃"
1630,2,"כִּי־מֵעִיר הַקֹּדֶשׁ נִקְרָאוּ וְעַל־אֱלֹהֵי יִשְׂרָאֵל נִסְמָכוּ יְהוָה צְבָאוֹת שְׁמוֹ ׃"
1630,3,"הָרִאשֹׁנוֹת מֵאָז הִגַּדְתִּי וּמִפִּי יָצְאוּ וְאַשְׁמִיעֵם פִּתְאֹם עָשִׂיתִי וַתָּבֹאנָה ׃"
1630,4,"מִדַּעְתִּי כִּי קָשֶׁה אָתָּה וְגִיד בַּרְזֶל עָרְפֶּךָ וּמִצְחֲךָ נְחוּשָׁה ׃"
1630,5,"וָאַגִּיד לְךָ מֵאָז בְּטֶרֶם תָּבוֹא הִשְׁמַעְתִּיךָ פֶּן־תֹּאמַר עָצְבִּי עָשָׂם וּפִסְלִי וְנִסְכִּי צִוָּם ׃"
1630,6,"שָׁמַעְתָּ חֲזֵה כֻּלָּהּ וְאַתֶּם הֲלוֹא תַגִּידוּ הִשְׁמַעְתִּיךָ חֲדָשׁוֹת מֵעַתָּה וּנְצֻרוֹת וְלֹא יְדַעְתָּם ׃"
1630,7,"עַתָּה נִבְרְאוּ וְלֹא מֵאָז וְלִפְנֵי־יוֹם וְלֹא שְׁמַעְתָּם פֶּן־תֹּאמַר הִנֵּה יְדַעְתִּין ׃"
1630,8,"גַּם לֹא־שָׁמַעְתָּ גַּם לֹא יָדַעְתָּ גַּם מֵאָז לֹא־פִתְּחָה אָזְנֶךָ כִּי יָדַעְתִּי בָּגוֹד תִּבְגּוֹד וּפֹשֵׁעַ מִבֶּטֶן קֹרָא לָךְ ׃"
1630,9,"לְמַעַן שְׁמִי אַאֲרִיךְ אַפִּי וּתְהִלָּתִי אֶחֱטָם־לָךְ לְבִלְתִּי הַכְרִיתֶךָ ׃"
1630,10,"הִנֵּה צְרַפְתִּיךָ וְלֹא בְכָסֶף בְּחַרְתִּיךָ בְּכוּר עֹנִי ׃"
1630,11,"לְמַעֲנִי לְמַעֲנִי אֶעֱשֶׂה כִּי אֵיךְ יֵחָל וּכְבוֹדִי לְאַחֵר לֹא־אֶתֵּן ׃"
1630,12,"שְׁמַע אֵלַי יַעֲקֹב וְיִשְׂרָאֵל מְקֹרָאִי אֲנִי־הוּא אֲנִי רִאשׁוֹן אַף אֲנִי אַחֲרוֹן ׃"
1630,13,"אַף־יָדִי יָסְדָה אֶרֶץ וִימִינִי טִפְּחָה שָׁמָיִם קֹרֵא אֲנִי אֲלֵיהֶם יַעַמְדוּ יַחְדָּו ׃"
1630,14,"הִקָּבְצוּ כֻלְּכֶם וּשֲׁמָעוּ מִי בָהֶם הִגִּיד אֶת־אֵלֶּה יְהוָה אֲהֵבוֹ יַעֲשֶׂה חֶפְצוֹ בְּבָבֶל וּזְרֹעוֹ כַּשְׂדִּים ׃"
1630,15,"אֲנִי אֲנִי דִּבַּרְתִּי אַף־קְרָאתִיו הֲבִיאֹתִיו וְהִצְלִיחַ דַּרְכּוֹ ׃"
1630,16,"קִרְבוּ אֵלַי שִׁמְעוּ־זֹאת לֹא מֵרֹאשׁ בַּסֵּתֶר דִּבַּרְתִּי מֵעֵת הֱיוֹתָהּ שָׁם אָנִי וְעַתָּה אֲדֹנָי יְהוִה שְׁלָחַנִי וְרוּחוֹ ׃"
1630,17,"כֹּה־אָמַר יְהוָה גֹּאַלְךָ קְדוֹשׁ יִשְׂרָאֵל אֲנִי יְהוָה אֱלֹהֶיךָ מְלַמֶּדְךָ לְהוֹעִיל מַדְרִיכֲךָ בְּדֶרֶךְ תֵּלֵךְ ׃"
1630,18,"לוּא הִקְשַׁבְתָּ לְמִצְוֹתָי וַיְהִי כַנָּהָר שְׁלוֹמֶךָ וְצִדְקָתְךָ כְּגַלֵּי הַיָּם ׃"
1630,19,"וַיְהִי כַחוֹל זַרְעֶךָ וְצֶאֱצָאֵי מֵעֶיךָ כִּמְעֹתָיו לֹא־יִכָּרֵת וְלֹא־יִשָּׁמֵד שְׁמוֹ מִלְּפָנָי ׃"
1630,20,"צְאוּ מִבָּבֶל בִּרְחוּ מִכַּשְׂדִּים בְּקוֹל רִנָּה הַגִּידוּ הַשְׁמִיעוּ זֹאת הוֹצִיאוּהָ עַד־קְצֵה הָאָרֶץ אִמְרוּ גָּאַל יְהוָה עַבְדּוֹ יַעֲקֹב ׃"
1630,21,"וְלֹא צָמְאוּ בָּחֳרָבוֹת הוֹלִיכָם מַיִם מִצּוּר הִזִּיל לָמוֹ וַיִּבְקַע־צוּר וַיָּזֻבוּ מָיִם ׃"
1630,22,"אֵין שָׁלוֹם אָמַר יְהוָה לָרְשָׁעִים ׃"
1631,1,"שִׁמְעוּ אִיִּים אֵלַי וְהַקְשִׁיבוּ לְאֻמִּים מֵרָחוֹק יְהוָה מִבֶּטֶן קְרָאָנִי מִמְּעֵי אִמִּי הִזְכִּיר שְׁמִי ׃"
1631,2,"וַיָּשֶׂם פִּי כְּחֶרֶב חַדָּה בְּצֵל יָדוֹ הֶחְבִּיאָנִי וַיְשִׂימֵנִי לְחֵץ בָּרוּר בְּאַשְׁפָּתוֹ הִסְתִּירָנִי ׃"
1631,3,"וַיֹּאמֶר לִי עַבְדִּי־אָתָּה יִשְׂרָאֵל אֲשֶׁר־בְּךָ אֶתְפָּאָר ׃"
1631,4,"וַאֲנִי אָמַרְתִּי לְרִיק יָגַעְתִּי לְתֹהוּ וְהֶבֶל כֹּחִי כִלֵּיתִי אָכֵן מִשְׁפָּטִי אֶת־יְהוָה וּפְעֻלָּתִי אֶת־אֱלֹהָי ׃"
1631,5,"וְעַתָּה אָמַר יְהוָה יֹצְרִי מִבֶּטֶן לְעֶבֶד לוֹ לְשׁוֹבֵב יַעֲקֹב אֵלָיו וְיִשְׂרָאֵל לֹא (לוֹ) יֵאָסֵף וְאֶכָּבֵד בְּעֵינֵי יְהוָה וֵאלֹהַי הָיָה עֻזִּי ׃"
1631,6,"וַיֹּאמֶר נָקֵל מִהְיוֹתְךָ לִי עֶבֶד לְהָקִים אֶת־שִׁבְטֵי יַעֲקֹב וּנְציּרֵי (וּנְצוּרֵי) יִשְׂרָאֵל לְהָשִׁיב וּנְתַתִּיךָ לְאוֹר גּוֹיִם לִהְיוֹת יְשׁוּעָתִי עַד־קְצֵה הָאָרֶץ ׃"
1631,7,"כֹּה אָמַר־יְהוָה גֹּאֵל יִשְׂרָאֵל קְדוֹשׁוֹ לִבְזֹה־נֶפֶשׁ לִמְתָעֵב גּוֹי לְעֶבֶד מֹשְׁלִים מְלָכִים יִרְאוּ וָקָמוּ שָׂרִים וְיִשְׁתַּחֲוּוּ לְמַעַן יְהוָה אֲשֶׁר נֶאֱמָן קְדֹשׁ יִשְׂרָאֵל וַיִּבְחָרֶךָּ ׃"
1631,8,"כֹּה אָמַר יְהוָה בְּעֵת רָצוֹן עֲנִיתִיךָ וּבְיוֹם יְשׁוּעָה עֲזַרְתִּיךָ וְאֶצָּרְךָ וְאֶתֶּנְךָ לִבְרִית עָם לְהָקִים אֶרֶץ לְהַנְחִיל נְחָלוֹת שֹׁמֵמוֹת ׃"
1631,9,"לֵאמֹר לַאֲסוּרִים צֵאוּ לַאֲשֶׁר בַּחֹשֶׁךְ הִגָּלוּ עַל־דְּרָכִים יִרְעוּ וּבְכָל־שְׁפָיִים מַרְעִיתָם ׃"
1631,10,"לֹא יִרְעָבוּ וְלֹא יִצְמָאוּ וְלֹא־יַכֵּם שָׁרָב וָשָׁמֶשׁ כִּי־מְרַחֲמָם יְנַהֲגֵם וְעַל־מַבּוּעֵי מַיִם יְנַהֲלֵם ׃"
1631,11,"וְשַׂמְתִּי כָל־הָרַי לַדָּרֶךְ וּמְסִלֹּתַי יְרֻמוּן ׃"
1631,12,"הִנֵּה־אֵלֶּה מֵרָחוֹק יָבֹאוּ וְהִנֵּה־אֵלֶּה מִצָּפוֹן וּמִיָּם וְאֵלֶּה מֵאֶרֶץ סִינִים ׃"
1631,13,"רָנּוּ שָׁמַיִם וְגִילִי אָרֶץ יּפִצְחוּ (וּפִצְחוּ) הָרִים רִנָּה כִּי־נִחַם יְהוָה עַמּוֹ וַעֲנִיָּו יְרַחֵם ׃"
1631,14,"וַתֹּאמֶר צִיּוֹן עֲזָבַנִי יְהוָה וַאדֹנָי שְׁכֵחָנִי ׃"
1631,15,"הֲתִשְׁכַּח אִשָּׁה עוּלָהּ מֵרַחֵם בֶּן־בִּטְנָהּ גַּם־אֵלֶּה תִשְׁכַּחְנָה וְאָנֹכִי לֹא אֶשְׁכָּחֵךְ ׃"
1631,16,"הֵן עַל־כַּפַּיִם חַקֹּתִיךְ חוֹמֹתַיִךְ נֶגְדִּי תָּמִיד ׃"
1631,17,"מִהֲרוּ בָּנָיִךְ מְהָרְסַיִךְ וּמַחֲרִבַיִךְ מִמֵּךְ יֵצֵאוּ ׃"
1631,18,"שְׂאִי־סָבִיב עֵינַיִךְ וּרְאִי כֻּלָּם נִקְבְּצוּ בָאוּ־לָךְ חַי־אָנִי נְאֻם־יְהוָה כִּי כֻלָּם כָּעֲדִי תִלְבָּשִׁי וּתְקַשְּׁרִים כַּכַּלָּה ׃"
1631,19,"כִּי חָרְבֹתַיִךְ וְשֹׁמְמֹתַיִךְ וְאֶרֶץ הֲרִסֻתֵיךְ כִּי עַתָּה תֵּצְרִי מִיּוֹשֵׁב וְרָחֲקוּ מְבַלְּעָיִךְ ׃"
1631,20,"עוֹד יֹאמְרוּ בְאָזְנַיִךְ בְּנֵי שִׁכֻּלָיִךְ צַר־לִי הַמָּקוֹם גְּשָׁה־לִּי וְאֵשֵׁבָה ׃"
1631,21,"וְאָמַרְתְּ בִּלְבָבֵךְ מִי יָלַד־לִי אֶת־אֵלֶּה וַאֲנִי שְׁכוּלָה וְגַלְמוּדָה גֹּלָה וְסוּרָה וְאֵלֶּה מִי גִדֵּל הֵן אֲנִי נִשְׁאַרְתִּי לְבַדִּי אֵלֶּה אֵיפֹה הֵם ׃"
1631,22,"כֹּה־אָמַר אֲדֹנָי יְהוִה הִנֵּה אֶשָּׂא אֶל־גּוֹיִם יָדִי וְאֶל־עַמִּים אָרִים נִסִּי וְהֵבִיאוּ בָנַיִךְ בְּחֹצֶן וּבְנֹתַיִךְ עַל־כָּתֵף תִּנָּשֶׂאנָה ׃"
1631,23,"וְהָיוּ מְלָכִים אֹמְנַיִךְ וְשָׂרוֹתֵיהֶם מֵינִיקֹתַיִךְ אַפַּיִם אֶרֶץ יִשְׁתַּחֲווּ לָךְ וַעֲפַר רַגְלַיִךְ יְלַחֵכוּ וְיָדַעַתְּ כִּי־אֲנִי יְהוָה אֲשֶׁר לֹא־יֵבֹשׁוּ קֹוָי ׃"
1631,24,"הֲיֻקַּח מִגִּבּוֹר מַלְקוֹחַ וְאִם־שְׁבִי צַדִּיק יִמָּלֵט ׃"
1631,25,"כִּי־כֹה אָמַר יְהוָה גַּם־שְׁבִי גִבּוֹר יֻקָּח וּמַלְקוֹחַ עָרִיץ יִמָּלֵט וְאֶת־יְרִיבֵךְ אָנֹכִי אָרִיב וְאֶת־בָּנַיִךְ אָנֹכִי אוֹשִׁיעַ ׃"
1631,26,"וְהַאֲכַלְתִּי אֶת־מוֹנַיִךְ אֶת־בְּשָׂרָם וְכֶעָסִיס דָּמָם יִשְׁכָּרוּן וְיָדְעוּ כָל־בָּשָׂר כִּי אֲנִי יְהוָה מוֹשִׁיעֵךְ וְגֹאֲלֵךְ אֲבִיר יַעֲקֹב ׃"
1632,1,"כֹּה אָמַר יְהוָה אֵי זֶה סֵפֶר כְּרִיתוּת אִמְּכֶם אֲשֶׁר שִׁלַּחְתִּיהָ אוֹ מִי מִנּוֹשַׁי אֲשֶׁר־מָכַרְתִּי אֶתְכֶם לוֹ הֵן בַּעֲוֹנֹתֵיכֶם נִמְכַּרְתֶּם וּבְפִשְׁעֵיכֶם שֻׁלְּחָה אִמְּכֶם ׃"
1632,2,"מַדּוּעַ בָּאתִי וְאֵין אִישׁ קָרָאתִי וְאֵין עוֹנֶה הֲקָצוֹר קָצְרָה יָדִי מִפְּדוּת וְאִם־אֵין־בִּי כֹחַ לְהַצִּיל הֵן בְּגַעֲרָתִי אַחֲרִיב יָם אָשִׂים נְהָרוֹת מִדְבָּר תִּבְאַשׁ דְּגָתָם מֵאֵין מַיִם וְתָמֹת בַּצָּמָא ׃"
1632,3,"אַלְבִּישׁ שָׁמַיִם קַדְרוּת וְשַׂק אָשִׂים כְּסוּתָם ׃"
1632,4,"אֲדֹנָי יְהוִֹה נָתַן לִי לְשׁוֹן לִמּוּדִים לָדַעַת לָעוּת אֶת־יָעֵף דָּבָר יָעִיר בַּבֹּקֶר בַּבֹּקֶר יָעִיר לִי אֹזֶן לִשְׁמֹעַ כַּלִּמּוּדִים ׃"
1632,5,"אֲדֹנָי יְהוִה פָּתַח־לִי אֹזֶן וְאָנֹכִי לֹא מָרִיתִי אָחוֹר לֹא נְסוּגֹתִי ׃"
1632,6,"גֵּוִי נָתַתִּי לְמַכִּים וּלְחָיַי לְמֹרְטִים פָּנַי לֹא הִסְתַּרְתִּי מִכְּלִמּוֹת וָרֹק ׃"
1632,7,"וַאדֹנָי יְהוִה יַעֲזָר־לִי עַל־כֵּן לֹא נִכְלָמְתִּי עַל־כֵּן שַׂמְתִּי פָנַי כַּחַלָּמִישׁ וָאֵדַע כִּי־לֹא אֵבוֹשׁ ׃"
1632,8,"קָרוֹב מַצְדִּיקִי מִי־יָרִיב אִתִּי נַעַמְדָה יָּחַד מִי־בַעַל מִשְׁפָּטִי יִגַּשׁ אֵלָי ׃"
1632,9,"הֵן אֲדֹנָי יְהוִה יַעֲזָר־לִי מִי־הוּא יַרְשִׁיעֵנִי הֵן כֻּלָּם כַּבֶּגֶד יִבְלוּ עָשׁ יֹאכְלֵם ׃"
1632,10,"מִי בָכֶם יְרֵא יְהוָה שֹׁמֵעַ בְּקוֹל עַבְדּוֹ אֲשֶׁר הָלַךְ חֲשֵׁכִים וְאֵין נֹגַהּ לוֹ יִבְטַח בְּשֵׁם יְהוָה וְיִשָּׁעֵן בֵּאלֹהָיו ׃"
1632,11,"הֵן כֻּלְּכֶם קֹדְחֵי אֵשׁ מְאַזְּרֵי זִיקוֹת לְכוּ בְּאוּר אֶשְׁכֶם וּבְזִיקוֹת בִּעַרְתֶּם מִיָּדִי הָיְתָה־זֹּאת לָכֶם לְמַעֲצֵבָה תִּשְׁכָּבוּן ׃"
1633,1,"שִׁמְעוּ אֵלַי רֹדְפֵי צֶדֶק מְבַקְשֵׁי יְהוָה הַבִּיטוּ אֶל־צוּר חֻצַּבְתֶּם וְאֶל־מַקֶּבֶת בּוֹר נֻקַּרְתֶּם ׃"
1633,2,"הַבִּיטוּ אֶל־אַבְרָהָם אֲבִיכֶם וְאֶל־שָׂרָה תְּחוֹלֶלְכֶם כִּי־אֶחָד קְרָאתִיו וַאֲבָרְכֵהוּ וְאַרְבֵּהוּ ׃"
1633,3,"כִּי־נִחַם יְהוָה צִיּוֹן נִחַם כָּל־חָרְבֹתֶיהָ וַיָּשֶׂם מִדְבָּרָהּ כְּעֵדֶן וְעַרְבָתָהּ כְּגַן־יְהוָה שָׂשׂוֹן וְשִׂמְחָה יִמָּצֵא בָהּ תּוֹדָה וְקוֹל זִמְרָה ׃"
1633,4,"הַקְשִׁיבוּ אֵלַי עַמִּי וּלְאוּמִּי אֵלַי הַאֲזִינוּ כִּי תוֹרָה מֵאִתִּי תֵצֵא וּמִשְׁפָּטִי לְאוֹר עַמִּים אַרְגִּיעַ ׃"
1633,5,"קָרוֹב צִדְקִי יָצָא יִשְׁעִי וּזְרֹעַי עַמִּים יִשְׁפֹּטוּ אֵלַי אִיִּים יְקַוּוּ וְאֶל־זְרֹעִי יְיַחֵלוּן ׃"
1633,6,"שְׂאוּ לַשָּׁמַיִם עֵינֵיכֶם וְהַבִּיטוּ אֶל־הָאָרֶץ מִתַּחַת כִּי־שָׁמַיִם כֶּעָשָׁן נִמְלָחוּ וְהָאָרֶץ כַּבֶּגֶד תִּבְלֶה וְיֹשְׁבֶיהָ כְּמוֹ־כֵן יְמוּתוּן וִישׁוּעָתִי לְעוֹלָם תִּהְיֶה וְצִדְקָתִי לֹא תֵחָת ׃"
1633,7,"שִׁמְעוּ אֵלַי יֹדְעֵי צֶדֶק עַם תּוֹרָתִי בְלִבָּם אַל־תִּירְאוּ חֶרְפַּת אֱנוֹשׁ וּמִגִּדֻּפֹתָם אַל־תֵּחָתּוּ ׃"
1633,8,"כִּי כַבֶּגֶד יֹאכְלֵם עָשׁ וְכַצֶּמֶר יֹאכְלֵם סָס וְצִדְקָתִי לְעוֹלָם תִּהְיֶה וִישׁוּעָתִי לְדוֹר דּוֹרִים ׃"
1633,9,"עוּרִי עוּרִי לִבְשִׁי־עֹז זְרוֹעַ יְהוָה עוּרִי כִּימֵי קֶדֶם דֹּרוֹת עוֹלָמִים הֲלוֹא אַתְּ־הִיא הַמַּחְצֶבֶת רַהַב מְחוֹלֶלֶת תַּנִּין ׃"
1633,10,"הֲלוֹא אַתְּ־הִיא הַמַּחֲרֶבֶת יָם מֵי תְּהוֹם רַבָּה הַשָּׂמָה מַעֲמַקֵּי־יָם דֶּרֶךְ לַעֲבֹר גְּאוּלִים ׃"
1633,11,"וּפְדוּיֵי יְהוָה יְשׁוּבוּן וּבָאוּ צִיּוֹן בְּרִנָּה וְשִׂמְחַת עוֹלָם עַל־רֹאשָׁם שָׂשׂוֹן וְשִׂמְחָה יַשִּׂיגוּן נָסוּ יָגוֹן וַאֲנָחָה ׃"
1633,12,"אָנֹכִי אָנֹכִי הוּא מְנַחֶמְכֶם מִי־אַתְּ וַתִּירְאִי מֵאֱנוֹשׁ יָמוּת וּמִבֶּן־אָדָם חָצִיר יִנָּתֵן ׃"
1633,13,"וַתִּשְׁכַּח יְהוָה עֹשֶׂךָ נוֹטֶה שָׁמַיִם וְיֹסֵד אָרֶץ וַתְּפַחֵד תָּמִיד כָּל־הַיּוֹם מִפְּנֵי חֲמַת הַמֵּצִיק כַּאֲשֶׁר כּוֹנֵן לְהַשְׁחִית וְאַיֵּה חֲמַת הַמֵּצִיק ׃"
1633,14,"מִהַר צֹעֶה לְהִפָּתֵחַ וְלֹא־יָמוּת לַשַּׁחַת וְלֹא יֶחְסַר לַחְמוֹ ׃"
1633,15,"וְאָנֹכִי יְהוָה אֱלֹהֶיךָ רֹגַע הַיָּם וַיֶּהֱמוּ גַּלָּיו יְהוָה צְבָאוֹת שְׁמוֹ ׃"
1633,16,"וָאָשִׂים דְּבָרַי בְּפִיךָ וּבְצֵל יָדִי כִּסִּיתִיךָ לִנְטֹעַ שָׁמַיִם וְלִיסֹד אָרֶץ וְלֵאמֹר לְצִיּוֹן עַמִּי־אָתָּה ׃"
1633,17,"הִתְעוֹרְרִי הִתְעוֹרְרִי קוּמִי יְרוּשָׁלִַם אֲשֶׁר שָׁתִית מִיַּד יְהוָה אֶת־כּוֹס חֲמָתוֹ אֶת־קֻבַּעַת כּוֹס הַתַּרְעֵלָה שָׁתִית מָצִית ׃"
1633,18,"אֵין־מְנַהֵל לָהּ מִכָּל־בָּנִים יָלָדָה וְאֵין מַחֲזִיק בְּיָדָהּ מִכָּל־בָּנִים גִּדֵּלָה ׃"
1633,19,"שְׁתַּיִם הֵנָּה קֹרְאֹתַיִךְ מִי יָנוּד לָךְ הַשֹּׁד וְהַשֶּׁבֶר וְהָרָעָב וְהַחֶרֶב מִי אֲנַחֲמֵךְ ׃"
1633,20,"בָּנַיִךְ עֻלְּפוּ שָׁכְבוּ בְּרֹאשׁ כָּל־חוּצוֹת כְּתוֹא מִכְמָר הַמְלֵאִים חֲמַת־יְהוָה גַּעֲרַת אֱלֹהָיִךְ ׃"
1633,21,"לָכֵן שִׁמְעִי־נָא זֹאת עֲנִיָּה וּשְׁכֻרַת וְלֹא מִיָּיִן ׃"
1633,22,"כֹּה־אָמַר אֲדֹנַיִךְ יְהוָה וֵאלֹהַיִךְ יָרִיב עַמּוֹ הִנֵּה לָקַחְתִּי מִיָּדֵךְ אֶת־כּוֹס הַתַּרְעֵלָה אֶת־קֻבַּעַת כּוֹס חֲמָתִי לֹא־תוֹסִיפִי לִשְׁתּוֹתָהּ עוֹד ׃"
1633,23,"וְשַׂמְתִּיהָ בְּיַד־מוֹגַיִךְ אֲשֶׁר־אָמְרוּ לְנַפְשֵׁךְ שְׁחִי וְנַעֲבֹרָה וַתָּשִׂימִי כָאָרֶץ גֵּוֵךְ וְכַחוּץ לַעֹבְרִים ׃"
1634,1,"עוּרִי עוּרִי לִבְשִׁי עֻזֵּךְ צִיּוֹן לִבְשִׁי בִּגְדֵי תִפְאַרְתֵּךְ יְרוּשָׁלִַם עִיר הַקֹּדֶשׁ כִּי לֹא יוֹסִיף יָבֹא־בָךְ עוֹד עָרֵל וְטָמֵא ׃"
1634,2,"הִתְנַעֲרִי מֵעָפָר קוּמִי שְּׁבִי יְרוּשָׁלִָם הִתְפַּתְּחִו (הִתְפַּתְּחִי) מוֹסְרֵי צַוָּארֵךְ שְׁבִיָּה בַּת־צִיּוֹן ׃"
1634,3,"כִּי־כֹה אָמַר יְהוָה חִנָּם נִמְכַּרְתֶּם וְלֹא בְכֶסֶף תִּגָּאֵלוּ ׃"
1634,4,"כִּי כֹה אָמַר אֲדֹנָי יְהוִה מִצְרַיִם יָרַד־עַמִּי בָרִאשֹׁנָה לָגוּר שָׁם וְאַשּׁוּר בְּאֶפֶס עֲשָׁקוֹ ׃"
1634,5,"וְעַתָּה מַי־ (מַה־) לִּי־פֹה נְאֻם־יְהוָה כִּי־לֻקַּח עַמִּי חִנָּם מֹשְׁלָו (מֹשְׁלָיו) יְהֵילִילוּ נְאֻם־יְהוָה וְתָמִיד כָּל־הַיּוֹם שְׁמִי מִנֹּאָץ ׃"
1634,6,"לָכֵן יֵדַע עַמִּי שְׁמִי לָכֵן בַּיּוֹם הַהוּא כִּי־אֲנִי־הוּא הַמְדַבֵּר הִנֵּנִי ׃"
1634,7,"מַה־נָּאווּ עַל־הֶהָרִים רַגְלֵי מְבַשֵּׂר מַשְׁמִיעַ שָׁלוֹם מְבַשֵּׂר טוֹב מַשְׁמִיעַ יְשׁוּעָה אֹמֵר לְצִיּוֹן מָלַךְ אֱלֹהָיִךְ ׃"
1634,8,"קוֹל צֹפַיִךְ נָשְׂאוּ קוֹל יַחְדָּו יְרַנֵּנוּ כִּי עַיִן בְּעַיִן יִרְאוּ בְּשׁוּב יְהוָה צִיּוֹן ׃"
1634,9,"פִּצְחוּ רַנְּנוּ יַחְדָּו חָרְבוֹת יְרוּשָׁלִָם כִּי־נִחַם יְהוָה עַמּוֹ גָּאַל יְרוּשָׁלִָם ׃"
1634,10,"חָשַׂף יְהוָה אֶת־זְרוֹעַ קָדְשׁוֹ לְעֵינֵי כָּל־הַגּוֹיִם וְרָאוּ כָּל־אַפְסֵי־אָרֶץ אֵת יְשׁוּעַת אֱלֹהֵינוּ ׃"
1634,11,"סוּרוּ סוּרוּ צְאוּ מִשָּׁם טָמֵא אַל־תִּגָּעוּ צְאוּ מִתּוֹכָהּ הִבָּרוּ נֹשְׂאֵי כְּלֵי יְהוָה ׃"
