0,1,2
1634,12,"כִּי לֹא בְחִפָּזוֹן תֵּצֵאוּ וּבִמְנוּסָה לֹא תֵלֵכוּן כִּי־הֹלֵךְ לִפְנֵיכֶם יְהוָה וּמְאַסִּפְכֶם אֱלֹהֵי יִשְׂרָאֵל ׃"
1634,13,"הִנֵּה יַשְׂכִּיל עַבְדִּי יָרוּם וְנִשָּׂא וְגָבַהּ מְאֹד ׃"
1634,14,"כַּאֲשֶׁר שָׁמְמוּ עָלֶיךָ רַבִּים כֵּן־מִשְׁחַת מֵאִישׁ מַרְאֵהוּ וְתֹאֲרוֹ מִבְּנֵי אָדָם ׃"
1634,15,"כֵּן יַזֶּה גּוֹיִם רַבִּים עָלָיו יִקְפְּצוּ מְלָכִים פִּיהֶם כִּי אֲשֶׁר לֹא־סֻפַּר לָהֶם רָאוּ וַאֲשֶׁר לֹא־שָׁמְעוּ הִתְבּוֹנָנוּ ׃"
1635,1,"מִי הֶאֱמִין לִשְׁמֻעָתֵנוּ וּזְרוֹעַ יְהוָה עַל־מִי נִגְלָתָה ׃"
1635,2,"וַיַּעַל כַּיּוֹנֵק לְפָנָיו וְכַשֹּׁרֶשׁ מֵאֶרֶץ צִיָּה לֹא־תֹאַר לוֹ וְלֹא הָדָר וְנִרְאֵהוּ וְלֹא־מַרְאֶה וְנֶחְמְדֵהוּ ׃"
1635,3,"נִבְזֶה וַחֲדַל אִישִׁים אִישׁ מַכְאֹבוֹת וִידוּעַ חֹלִי וּכְמַסְתֵּר פָּנִים מִמֶּנּוּ נִבְזֶה וְלֹא חֲשַׁבְנֻהוּ ׃"
1635,4,"אָכֵן חֳלָיֵנוּ הוּא נָשָׂא וּמַכְאֹבֵינוּ סְבָלָם וַאֲנַחְנוּ חֲשַׁבְנֻהוּ נָגוּעַ מֻכֵּה אֱלֹהִים וּמְעֻנֶּה ׃"
1635,5,"וְהוּא מְחֹלָל מִפְּשָׁעֵנוּ מְדֻכָּא מֵעֲוֹנֹתֵינוּ מוּסַר שְׁלוֹמֵנוּ עָלָיו וּבַחֲבֻרָתוֹ נִרְפָּא־לָנוּ ׃"
1635,6,"כֻּלָּנוּ כַּצֹּאן תָּעִינוּ אִישׁ לְדַרְכּוֹ פָּנִינוּ וַיהוָה הִפְגִּיעַ בּוֹ אֵת עֲוֹן כֻּלָּנוּ ׃"
1635,7,"נִגַּשׂ וְהוּא נַעֲנֶה וְלֹא יִפְתַּח־פִּיו כַּשֶּׂה לַטֶּבַח יוּבָל וּכְרָחֵל לִפְנֵי גֹזְזֶיהָ נֶאֱלָמָה וְלֹא יִפְתַּח פִּיו ׃"
1635,8,"מֵעֹצֶר וּמִמִּשְׁפָּט לֻקָּח וְאֶת־דּוֹרוֹ מִי יְשׂוֹחֵחַ כִּי נִגְזַר מֵאֶרֶץ חַיִּים מִפֶּשַׁע עַמִּי נֶגַע לָמוֹ ׃"
1635,9,"וַיִּתֵּן אֶת־רְשָׁעִים קִבְרוֹ וְאֶת־עָשִׁיר בְּמֹתָיו עַל לֹא־חָמָס עָשָׂה וְלֹא מִרְמָה בְּפִיו ׃"
1635,10,"וַיהוָה חָפֵץ דַּכְּאוֹ הֶחֱלִי אִם־תָּשִׂים אָשָׁם נַפְשׁוֹ יִרְאֶה זֶרַע יַאֲרִיךְ יָמִים וְחֵפֶץ יְהוָה בְּיָדוֹ יִצְלָח ׃"
1635,11,"מֵעֲמַל נַפְשׁוֹ יִרְאֶה יִשְׂבָּע בְּדַעְתּוֹ יַצְדִּיק צַדִּיק עַבְדִּי לָרַבִּים וַעֲוֹנֹתָם הוּא יִסְבֹּל ׃"
1635,12,"לָכֵן אֲחַלֶּק־לוֹ בָרַבִּים וְאֶת־עֲצוּמִים יְחַלֵּק שָׁלָל תַּחַת אֲשֶׁר הֶעֱרָה לַמָּוֶת נַפְשׁוֹ וְאֶת־פֹּשְׁעִים נִמְנָה וְהוּא חֵטְא־רַבִּים נָשָׂא וְלַפֹּשְׁעִים יַפְגִּיעַ ׃"
1636,1,"רָנִּי עֲקָרָה לֹא יָלָדָה פִּצְחִי רִנָּה וְצַהֲלִי לֹא־חָלָה כִּי־רַבִּים בְּנֵי־שׁוֹמֵמָה מִבְּנֵי בְעוּלָה אָמַר יְהוָה ׃"
1636,2,"הַרְחִיבִי מְקוֹם אָהֳלֵךְ וִירִיעוֹת מִשְׁכְּנוֹתַיִךְ יַטּוּ אַל־תַּחְשֹׂכִי הַאֲרִיכִי מֵיתָרַיִךְ וִיתֵדֹתַיִךְ חַזֵּקִי ׃"
1636,3,"כִּי־יָמִין וּשְׂמֹאול תִּפְרֹצִי וְזַרְעֵךְ גּוֹיִם יִירָשׁ וְעָרִים נְשַׁמּוֹת יוֹשִׁיבוּ ׃"
1636,4,"אַל־תִּירְאִי כִּי־לֹא תֵבוֹשִׁי וְאַל־תִּכָּלְמִי כִּי לֹא תַחְפִּירִי כִּי בֹשֶׁת עֲלוּמַיִךְ תִּשְׁכָּחִי וְחֶרְפַּת אַלְמְנוּתַיִךְ לֹא תִזְכְּרִי־עוֹד ׃"
1636,5,"כִּי בֹעֲלַיִךְ עֹשַׂיִךְ יְהוָה צְבָאוֹת שְׁמוֹ וְגֹאֲלֵךְ קְדוֹשׁ יִשְׂרָאֵל אֱלֹהֵי כָל־הָאָרֶץ יִקָּרֵא ׃"
1636,6,"כִּי־כְאִשָּׁה עֲזוּבָה וַעֲצוּבַת רוּחַ קְרָאָךְ יְהוָה וְאֵשֶׁת נְעוּרִים כִּי תִמָּאֵס אָמַר אֱלֹהָיִךְ ׃"
1636,7,"בְּרֶגַע קָטֹן עֲזַבְתִּיךְ וּבְרַחֲמִים גְּדֹלִים אֲקַבְּצֵךְ ׃"
1636,8,"בְּשֶׁצֶף קֶצֶף הִסְתַּרְתִּי פָנַי רֶגַע מִמֵּךְ וּבְחֶסֶד עוֹלָם רִחַמְתִּיךְ אָמַר גֹּאֲלֵךְ יְהוָה ׃"
1636,9,"כִּי־מֵי נֹחַ זֹאת לִי אֲשֶׁר נִשְׁבַּעְתִּי מֵעֲבֹר מֵי־נֹחַ עוֹד עַל־הָאָרֶץ כֵּן נִשְׁבַּעְתִּי מִקְּצֹף עָלַיִךְ וּמִגְּעָר־בָּךְ ׃"
1636,10,"כִּי הֶהָרִים יָמוּשׁוּ וְהַגְּבָעוֹת תְּמוּטֶנָה וְחַסְדִּי מֵאִתֵּךְ לֹא־יָמוּשׁ וּבְרִית שְׁלוֹמִי לֹא תָמוּט אָמַר מְרַחֲמֵךְ יְהוָה ׃"
1636,11,"עֲנִיָּה סֹעֲרָה לֹא נֻחָמָה הִנֵּה אָנֹכִי מַרְבִּיץ בַּפּוּךְ אֲבָנַיִךְ וִיסַדְתִּיךְ בַּסַּפִּירִים ׃"
1636,12,"וְשַׂמְתִּי כַּדְכֹד שִׁמְשֹׁתַיִךְ וּשְׁעָרַיִךְ לְאַבְנֵי אֶקְדָּח וְכָל־גְּבוּלֵךְ לְאַבְנֵי־חֵפֶץ ׃"
1636,13,"וְכָל־בָּנַיִךְ לִמּוּדֵי יְהוָה וְרַב שְׁלוֹם בָּנָיִךְ ׃"
1636,14,"בִּצְדָקָה תִּכּוֹנָנִי רַחֲקִי מֵעֹשֶׁק כִּי־לֹא תִירָאִי וּמִמְּחִתָּה כִּי לֹא־תִקְרַב אֵלָיִךְ ׃"
1636,15,"הֵן גּוֹר יָגוּר אֶפֶס מֵאוֹתִי מִי־גָר אִתָּךְ עָלַיִךְ יִפּוֹל ׃"
1636,16,"הִןֵּ (הִנֵּה) אָנֹכִי בָּרָאתִי חָרָשׁ נֹפֵחַ בְּאֵשׁ פֶּחָם וּמוֹצִיא כְלִי לְמַעֲשֵׂהוּ וְאָנֹכִי בָּרָאתִי מַשְׁחִית לְחַבֵּל ׃"
1636,17,"כָּל־כְּלִי יוּצַר עָלַיִךְ לֹא יִצְלָח וְכָל־לָשׁוֹן תָּקוּם־אִתָּךְ לַמִּשְׁפָּט תַּרְשִׁיעִי זֹאת נַחֲלַת עַבְדֵי יְהוָה וְצִדְקָתָם מֵאִתִּי נְאֻם־יְהוָה ׃"
1637,1,"הוֹי כָּל־צָמֵא לְכוּ לַמַּיִם וַאֲשֶׁר אֵין־לוֹ כָּסֶף לְכוּ שִׁבְרוּ וֶאֱכֹלוּ וּלְכוּ שִׁבְרוּ בְּלוֹא־כֶסֶף וּבְלוֹא מְחִיר יַיִן וְחָלָב ׃"
1637,2,"לָמָּה תִשְׁקְלוּ־כֶסֶף בְּלוֹא־לֶחֶם וִיגִיעֲכֶם בְּלוֹא לְשָׂבְעָה שִׁמְעוּ שָׁמוֹעַ אֵלַי וְאִכְלוּ־טוֹב וְתִתְעַנַּג בַּדֶּשֶׁן נַפְשְׁכֶם ׃"
1637,3,"הַטּוּ אָזְנְכֶם וּלְכוּ אֵלַי שִׁמְעוּ וּתְחִי נַפְשְׁכֶם וְאֶכְרְתָה לָכֶם בְּרִית עוֹלָם חַסְדֵי דָוִד הַנֶּאֱמָנִים ׃"
1637,4,"הֵן עֵד לְאוּמִּים נְתַתִּיו נָגִיד וּמְצַוֵּה לְאֻמִּים ׃"
1637,5,"הֵן גּוֹי לֹא־תֵדַע תִּקְרָא וְגוֹי לֹא־יְדָעוּךָ אֵלֶיךָ יָרוּצוּ לְמַעַן יְהוָה אֱלֹהֶיךָ וְלִקְדוֹשׁ יִשְׂרָאֵל כִּי פֵאֲרָךְ ׃"
1637,6,"דִּרְשׁוּ יְהוָה בְּהִמָּצְאוֹ קְרָאֻהוּ בִּהְיוֹתוֹ קָרוֹב ׃"
1637,7,"יַעֲזֹב רָשָׁע דַּרְכּוֹ וְאִישׁ אָוֶן מַחְשְׁבֹתָיו וְיָשֹׁב אֶל־יְהוָה וִירַחֲמֵהוּ וְאֶל־אֱלֹהֵינוּ כִּי־יַרְבֶּה לִסְלוֹחַ ׃"
1637,8,"כִּי לֹא מַחְשְׁבוֹתַי מַחְשְׁבוֹתֵיכֶם וְלֹא דַרְכֵיכֶם דְּרָכָי נְאֻם יְהוָה ׃"
1637,9,"כִּי־גָבְהוּ שָׁמַיִם מֵאָרֶץ כֵּן גָּבְהוּ דְרָכַי מִדַּרְכֵיכֶם וּמַחְשְׁבֹתַי מִמַּחְשְׁבֹתֵיכֶם ׃"
1637,10,"כִּי כַּאֲשֶׁר יֵרֵד הַגֶּשֶׁם וְהַשֶּׁלֶג מִן־הַשָּׁמַיִם וְשָׁמָּה לֹא יָשׁוּב כִּי אִם־הִרְוָה אֶת־הָאָרֶץ וְהוֹלִידָהּ וְהִצְמִיחָהּ וְנָתַן זֶרַע לַזֹּרֵעַ וְלֶחֶם לָאֹכֵל ׃"
1637,11,"כֵּן יִהְיֶה דְבָרִי אֲשֶׁר יֵצֵא מִפִּי לֹא־יָשׁוּב אֵלַי רֵיקָם כִּי אִם־עָשָׂה אֶת־אֲשֶׁר חָפַצְתִּי וְהִצְלִיחַ אֲשֶׁר שְׁלַחְתִּיו ׃"
1637,12,"כִּי־בְשִׂמְחָה תֵצֵאוּ וּבְשָׁלוֹם תּוּבָלוּן הֶהָרִים וְהַגְּבָעוֹת יִפְצְחוּ לִפְנֵיכֶם רִנָּה וְכָל־עֲצֵי הַשָּׂדֶה יִמְחֲאוּ־כָף ׃"
1637,13,"תַּחַת הַנַּעֲצוּץ יַעֲלֶה בְרוֹשׁ ְתַחַת (וְתַחַת) הַסִּרְפַּד יַעֲלֶה הֲדַס וְהָיָה לַיהוָה לְשֵׁם לְאוֹת עוֹלָם לֹא יִכָּרֵת ׃"
1638,1,"כֹּה אָמַר יְהוָה שִׁמְרוּ מִשְׁפָּט וַעֲשׂוּ צְדָקָה כִּי־קְרוֹבָה יְשׁוּעָתִי לָבוֹא וְצִדְקָתִי לְהִגָּלוֹת ׃"
1638,2,"אַשְׁרֵי אֱנוֹשׁ יַעֲשֶׂה־זֹּאת וּבֶן־אָדָם יַחֲזִיק בָּהּ שֹׁמֵר שַׁבָּת מֵחַלְּלוֹ וְשֹׁמֵר יָדוֹ מֵעֲשׂוֹת כָּל־רָע ׃"
1638,3,"וְאַל־יֹאמַר בֶּן־הַנֵּכָר הַנִּלְוָה אֶל־יְהוָה לֵאמֹר הַבְדֵּל יַבְדִּילַנִי יְהוָה מֵעַל עַמּוֹ וְאַל־יֹאמַר הַסָּרִיס הֵן אֲנִי עֵץ יָבֵשׁ ׃"
1638,4,"כִּי־כֹה אָמַר יְהוָה לַסָּרִיסִים אֲשֶׁר יִשְׁמְרוּ אֶת־שַׁבְּתוֹתַי וּבָחֲרוּ בַּאֲשֶׁר חָפָצְתִּי וּמַחֲזִיקִים בִּבְרִיתִי ׃"
1638,5,"וְנָתַתִּי לָהֶם בְּבֵיתִי וּבְחוֹמֹתַי יָד וָשֵׁם טוֹב מִבָּנִים וּמִבָּנוֹת שֵׁם עוֹלָם אֶתֶּן־לוֹ אֲשֶׁר לֹא יִכָּרֵת ׃"
1638,6,"וּבְנֵי הַנֵּכָר הַנִּלְוִים עַל־יְהוָה לְשָׁרְתוֹ וּלְאַהֲבָה אֶת־שֵׁם יְהוָה לִהְיוֹת לוֹ לַעֲבָדִים כָּל־שֹׁמֵר שַׁבָּת מֵחַלְּלוֹ וּמַחֲזִיקִים בִּבְרִיתִי ׃"
1638,7,"וַהֲבִיאוֹתִים אֶל־הַר קָדְשִׁי וְשִׂמַּחְתִּים בְּבֵית תְּפִלָּתִי עוֹלֹתֵיהֶם וְזִבְחֵיהֶם לְרָצוֹן עַל־מִזְבְּחִי כִּי בֵיתִי בֵּית־תְּפִלָּה יִקָּרֵא לְכָל־הָעַמִּים ׃"
1638,8,"נְאֻם אֲדֹנָי יְהוִה מְקַבֵּץ נִדְחֵי יִשְׂרָאֵל עוֹד אֲקַבֵּץ עָלָיו לְנִקְבָּצָיו ׃"
1638,9,"כֹּל חַיְתוֹ שָׂדָי אֵתָיוּ לֶאֱכֹל כָּל־חַיְתוֹ בַּיָּעַר ׃"
1638,10,"צֹפָו (צֹפָיו) עִוְרִים כֻּלָּם לֹא יָדָעוּ כֻּלָּם כְּלָבִים אִלְּמִים לֹא יוּכְלוּ לִנְבֹּחַ הֹזִים שֹׁכְבִים אֹהֲבֵי לָנוּם ׃"
1638,11,"וְהַכְּלָבִים עַזֵּי־נֶפֶשׁ לֹא יָדְעוּ שָׂבְעָה וְהֵמָּה רֹעִים לֹא יָדְעוּ הָבִין כֻּלָּם לְדַרְכָּם פָּנוּ אִישׁ לְבִצְעוֹ מִקָּצֵהוּ ׃"
1638,12,"אֵתָיוּ אֶקְחָה־יַיִן וְנִסְבְּאָה שֵׁכָר וְהָיָה כָזֶה יוֹם מָחָר גָּדוֹל יֶתֶר מְאֹד ׃"
1639,1,"הַצַּדִּיק אָבָד וְאֵין אִישׁ שָׂם עַל־לֵב וְאַנְשֵׁי־חֶסֶד נֶאֱסָפִים בְּאֵין מֵבִין כִּי־מִפְּנֵי הָרָעָה נֶאֱסַף הַצַּדִּיק ׃"
1639,2,"יָבוֹא שָׁלוֹם יָנוּחוּ עַל־מִשְׁכְּבוֹתָם הֹלֵךְ נְכֹחוֹ ׃"
1639,3,"וְאַתֶּם קִרְבוּ־הֵנָּה בְּנֵי עֹנְנָה זֶרַע מְנָאֵף וַתִּזְנֶה ׃"
1639,4,"עַל־מִי תִּתְעַנָּגוּ עַל־מִי תַּרְחִיבוּ פֶה תַּאֲרִיכוּ לָשׁוֹן הֲלוֹא־אַתֶּם יִלְדֵי־פֶשַׁע זֶרַע שָׁקֶר ׃"
1639,5,"הַנֵּחָמִים בָּאֵלִים תַּחַת כָּל־עֵץ רַעֲנָן שֹׁחֲטֵי הַיְלָדִים בַּנְּחָלִים תַּחַת סְעִפֵי הַסְּלָעִים ׃"
1639,6,"בְּחַלְּקֵי־נַחַל חֶלְקֵךְ הֵם הֵם גּוֹרָלֵךְ גַּם־לָהֶם שָׁפַכְתְּ נֶסֶךְ הֶעֱלִית מִנְחָה הַעַל אֵלֶּה אֶנָּחֵם ׃"
1639,7,"עַל הַר־גָּבֹהַּ וְנִשָּׂא שַׂמְתְּ מִשְׁכָּבֵךְ גַּם־שָׁם עָלִית לִזְבֹּחַ זָבַח ׃"
1639,8,"וְאַחַר הַדֶּלֶת וְהַמְּזוּזָה שַׂמְתְּ זִכְרוֹנֵךְ כִּי מֵאִתִּי גִּלִּית וַתַּעֲלִי הִרְחַבְתְּ מִשְׁכָּבֵךְ וַתִּכְרָת־לָךְ מֵהֶם אָהַבְתְּ מִשְׁכָּבָם יָד חָזִית ׃"
1639,9,"וַתָּשֻׁרִי לַמֶּלֶךְ בַּשֶּׁמֶן וַתַּרְבִּי רִקֻּחָיִךְ וַתְּשַׁלְּחִי צִרַיִךְ עַד־מֵרָחֹק וַתַּשְׁפִּילִי עַד־שְׁאוֹל ׃"
1639,10,"בְּרֹב דַּרְכֵּךְ יָגַעַתְּ לֹא אָמַרְתְּ נוֹאָשׁ חַיַּת יָדֵךְ מָצָאת עַל־כֵּן לֹא חָלִית ׃"
1639,11,"וְאֶת־מִי דָּאַגְתְּ וַתִּירְאִי כִּי תְכַזֵּבִי וְאוֹתִי לֹא זָכַרְתְּ לֹא־שַׂמְתְּ עַל־לִבֵּךְ הֲלֹא אֲנִי מַחְשֶׁה וּמֵעֹלָם וְאוֹתִי לֹא תִירָאִי ׃"
1639,12,"אֲנִי אַגִּיד צִדְקָתֵךְ וְאֶת־מַעֲשַׂיִךְ וְלֹא יוֹעִילוּךְ ׃"
1639,13,"בְּזַעֲקֵךְ יַצִּילֻךְ קִבּוּצַיִךְ וְאֶת־כֻּלָּם יִשָּׂא־רוּחַ יִקַּח־הָבֶל וְהַחוֹסֶה בִי יִנְחַל־אֶרֶץ וְיִירַשׁ הַר־קָדְשִׁי ׃"
1639,14,"וְאָמַר סֹלּוּ־סֹלּוּ פַּנּוּ־דָרֶךְ הָרִימוּ מִכְשׁוֹל מִדֶּרֶךְ עַמִּי ׃"
1639,15,"כִּי כֹה אָמַר רָם וְנִשָּׂא שֹׁכֵן עַד וְקָדוֹשׁ שְׁמוֹ מָרוֹם וְקָדוֹשׁ אֶשְׁכּוֹן וְאֶת־דַּכָּא וּשְׁפַל־רוּחַ לְהַחֲיוֹת רוּחַ שְׁפָלִים וּלְהַחֲיוֹת לֵב נִדְכָּאִים ׃"
1639,16,"כִּי לֹא לְעוֹלָם אָרִיב וְלֹא לָנֶצַח אֶקְּצוֹף כִּי־רוּחַ מִלְּפָנַי יַעֲטוֹף וּנְשָׁמוֹת אֲנִי עָשִׂיתִי ׃"
1639,17,"בַּעֲוֹן בִּצְעוֹ קָצַפְתִּי וְאַכֵּהוּ הַסְתֵּר וְאֶקְצֹף וַיֵּלֶךְ שׁוֹבָב בְּדֶרֶךְ לִבּוֹ ׃"
1639,18,"דְּרָכָיו רָאִיתִי וְאֶרְפָּאֵהוּ וְאַנְחֵהוּ וַאֲשַׁלֵּם נִחֻמִים לוֹ וְלַאֲבֵלָיו ׃"
1639,19,"בּוֹרֵא נִוב (נִיב) שְׂפָתָיִם שָׁלוֹם שָׁלוֹם לָרָחוֹק וְלַקָּרוֹב אָמַר יְהוָה וּרְפָאתִיו ׃"
1639,20,"וְהָרְשָׁעִים כַּיָּם נִגְרָשׁ כִּי הַשְׁקֵט לֹא יוּכָל וַיִּגְרְשׁוּ מֵימָיו רֶפֶשׁ וָטִיט ׃"
1639,21,"אֵין שָׁלוֹם אָמַר אֱלֹהַי לָרְשָׁעִים ׃"
1640,1,"קְרָא בְגָרוֹן אַל־תַּחְשֹׂךְ כַּשּׁוֹפָר הָרֵם קוֹלֶךָ וְהַגֵּד לְעַמִּי פִּשְׁעָם וּלְבֵית יַעֲקֹב חַטֹּאתָם ׃"
1640,2,"וְאוֹתִי יוֹם יוֹם יִדְרֹשׁוּן וְדַעַת דְּרָכַי יֶחְפָּצוּן כְּגוֹי אֲשֶׁר־צְדָקָה עָשָׂה וּמִשְׁפַּט אֱלֹהָיו לֹא עָזָב יִשְׁאָלוּנִי מִשְׁפְּטֵי־צֶדֶק קִרְבַת אֱלֹהִים יֶחְפָּצוּן ׃"
1640,3,"לָמָּה צַּמְנוּ וְלֹא רָאִיתָ עִנִּינוּ נַפְשֵׁנוּ וְלֹא תֵדָע הֵן בְּיוֹם צֹמְכֶם תִּמְצְאוּ־חֵפֶץ וְכָל־עַצְּבֵיכֶם תִּנְגֹּשׂוּ ׃"
1640,4,"הֵן לְרִיב וּמַצָּה תָּצוּמוּ וּלְהַכּוֹת בְּאֶגְרֹף רֶשַׁע לֹא־תָצוּמוּ כַיּוֹם לְהַשְׁמִיעַ בַּמָּרוֹם קוֹלְכֶם ׃"
1640,5,"הֲכָזֶה יִהְיֶה צוֹם אֶבְחָרֵהוּ יוֹם עַנּוֹת אָדָם נַפְשׁוֹ הֲלָכֹף כְּאַגְמֹן רֹאשׁוֹ וְשַׂק וָאֵפֶר יַצִּיעַ הֲלָזֶה תִּקְרָא־צוֹם וְיוֹם רָצוֹן לַיהוָה ׃"
1640,6,"הֲלוֹא זֶה צוֹם אֶבְחָרֵהוּ פַּתֵּחַ חַרְצֻבּוֹת רֶשַׁע הַתֵּר אֲגֻדּוֹת מוֹטָה וְשַׁלַּח רְצוּצִים חָפְשִׁים וְכָל־מוֹטָה תְּנַתֵּקוּ ׃"
1640,7,"הֲלוֹא פָרֹס לָרָעֵב לַחְמֶךָ וַעֲנִיִּים מְרוּדִים תָּבִיא בָיִת כִּי־תִרְאֶה עָרֹם וְכִסִּיתוֹ וּמִבְּשָׂרְךָ לֹא תִתְעַלָּם ׃"
1640,8,"אָז יִבָּקַע כַּשַּׁחַר אוֹרֶךָ וַאֲרֻכָתְךָ מְהֵרָה תִצְמָח וְהָלַךְ לְפָנֶיךָ צִדְקֶךָ כְּבוֹד יְהוָה יַאַסְפֶךָ ׃"
1640,9,"אָז תִּקְרָא וַיהוָה יַעֲנֶה תְּשַׁוַּע וְיֹאמַר הִנֵּנִי אִם־תָּסִיר מִתּוֹכְךָ מוֹטָה שְׁלַח אֶצְבַּע וְדַבֶּר־אָוֶן ׃"
1640,10,"וְתָפֵק לָרָעֵב נַפְשֶׁךָ וְנֶפֶשׁ נַעֲנָה תַּשְׂבִּיעַ וְזָרַח בַּחֹשֶׁךְ אוֹרֶךָ וַאֲפֵלָתְךָ כַּצָּהֳרָיִם ׃"
1640,11,"וְנָחֲךָ יְהוָה תָּמִיד וְהִשְׂבִּיעַ בְּצַחְצָחוֹת נַפְשֶׁךָ וְעַצְמֹתֶיךָ יַחֲלִיץ וְהָיִיתָ כְּגַן רָוֶה וּכְמוֹצָא מַיִם אֲשֶׁר לֹא־יְכַזְּבוּ מֵימָיו ׃"
1640,12,"וּבָנוּ מִמְּךָ חָרְבוֹת עוֹלָם מוֹסְדֵי דוֹר־וָדוֹר תְּקוֹמֵם וְקֹרָא לְךָ גֹּדֵר פֶּרֶץ מְשֹׁבֵב נְתִיבוֹת לָשָׁבֶת ׃"
1640,13,"אִם־תָּשִׁיב מִשַּׁבָּת רַגְלֶךָ עֲשׂוֹת חֲפָצֶיךָ בְּיוֹם קָדְשִׁי וְקָרָאתָ לַשַּׁבָּת עֹנֶג לִקְדוֹשׁ יְהוָה מְכֻבָּד וְכִבַּדְתּוֹ מֵעֲשׂוֹת דְּרָכֶיךָ מִמְּצוֹא חֶפְצְךָ וְדַבֵּר דָּבָר ׃"
1640,14,"אָז תִּתְעַנַּג עַל־יְהוָה וְהִרְכַּבְתִּיךָ עַל־בָּמֳותֵי (בָּמֳתֵי) אָרֶץ וְהַאֲכַלְתִּיךָ נַחֲלַת יַעֲקֹב אָבִיךָ כִּי פִּי יְהוָה דִּבֵּר ׃"
1641,1,"הֵן לֹא־קָצְרָה יַד־יְהוָה מֵהוֹשִׁיעַ וְלֹא־כָבְדָה אָזְנוֹ מִשְּׁמוֹעַ ׃"
1641,2,"כִּי אִם־עֲוֹנֹתֵיכֶם הָיוּ מַבְדִּלִים בֵּינֵכֶם לְבֵין אֱלֹהֵיכֶם וְחַטֹּאותֵיכֶם הִסְתִּירוּ פָנִים מִכֶּם מִשְּׁמוֹעַ ׃"
1641,3,"כִּי כַפֵּיכֶם נְגֹאֲלוּ בַדָּם וְאֶצְבְּעוֹתֵיכֶם בֶּעָוֹן שִׂפְתוֹתֵיכֶם דִּבְּרוּ־שֶׁקֶר לְשׁוֹנְכֶם עַוְלָה תֶהְגֶּה ׃"
1641,4,"אֵין־קֹרֵא בְצֶדֶק וְאֵין נִשְׁפָּט בֶּאֱמוּנָה בָּטוֹחַ עַל־תֹּהוּ וְדַבֶּר־שָׁוְא הָרוֹ עָמָל וְהוֹלֵיד אָוֶן ׃"
1641,5,"בֵּיצֵי צִפְעוֹנִי בִּקֵּעוּ וְקוּרֵי עַכָּבִישׁ יֶאֱרֹגוּ הָאֹכֵל מִבֵּיצֵיהֶם יָמוּת וְהַזּוּרֶה תִּבָּקַע אֶפְעֶה ׃"
1641,6,"קוּרֵיהֶם לֹא־יִהְיוּ לְבֶגֶד וְלֹא יִתְכַּסּוּ בְּמַעֲשֵׂיהֶם מַעֲשֵׂיהֶם מַעֲשֵׂי־אָוֶן וּפֹעַל חָמָס בְּכַפֵּיהֶם ׃"
1641,7,"רַגְלֵיהֶם לָרַע יָרֻצוּ וִימַהֲרוּ לִשְׁפֹּךְ דָּם נָקִי מַחְשְׁבוֹתֵיהֶם מַחְשְׁבוֹת אָוֶן שֹׁד וָשֶׁבֶר בִּמְסִלּוֹתָם ׃"
1641,8,"דֶּרֶךְ שָׁלוֹם לֹא יָדָעוּ וְאֵין מִשְׁפָּט בְּמַעְגְּלוֹתָם נְתִיבוֹתֵיהֶם עִקְּשׁוּ לָהֶם כֹּל דֹּרֵךְ בָּהּ לֹא יָדַע שָׁלוֹם ׃"
1641,9,"עַל־כֵּן רָחַק מִשְׁפָּט מִמֶּנּוּ וְלֹא תַשִּׂיגֵנוּ צְדָקָה נְקַוֶּה לָאוֹר וְהִנֵּה־חֹשֶׁךְ לִנְגֹהוֹת בָּאֲפֵלוֹת נְהַלֵּךְ ׃"
1641,10,"נְגַשְׁשָׁה כַעִוְרִים קִיר וּכְאֵין עֵינַיִם נְגַשֵּׁשָׁה כָּשַׁלְנוּ בַצָּהֳרַיִם כַּנֶּשֶׁף בָּאַשְׁמַנִּים כַּמֵּתִים ׃"
1641,11,"נֶהֱמֶה כַדֻּבִּים כֻּלָּנוּ וְכַיּוֹנִים הָגֹה נֶהְגֶּה נְקַוֶּה לַמִּשְׁפָּט וָאַיִן לִישׁוּעָה רָחֲקָה מִמֶּנּוּ ׃"
1641,12,"כִּי־רַבּוּ פְשָׁעֵינוּ נֶגְדֶּךָ וְחַטֹּאותֵינוּ עָנְתָה בָּנוּ כִּי־פְשָׁעֵינוּ אִתָּנוּ וַעֲוֹנֹתֵינוּ יְדַעֲנוּם ׃"
1641,13,"פָּשֹׁעַ וְכַחֵשׁ בַּיהוָה וְנָסוֹג מֵאַחַר אֱלֹהֵינוּ דַּבֶּר־עֹשֶׁק וְסָרָה הֹרוֹ וְהֹגוֹ מִלֵּב דִּבְרֵי־שָׁקֶר ׃"
1641,14,"וְהֻסַּג אָחוֹר מִשְׁפָּט וּצְדָקָה מֵרָחוֹק תַּעֲמֹד כִּי־כָשְׁלָה בָרְחוֹב אֱמֶת וּנְכֹחָה לֹא־תוּכַל לָבוֹא ׃"
1641,15,"וַתְּהִי הָאֱמֶת נֶעְדֶּרֶת וְסָר מֵרָע מִשְׁתּוֹלֵל וַיַּרְא יְהוָה וַיֵּרַע בְּעֵינָיו כִּי־אֵין מִשְׁפָּט ׃"
1641,16,"וַיַּרְא כִּי־אֵין אִישׁ וַיִּשְׁתּוֹמֵם כִּי אֵין מַפְגִּיעַ וַתּוֹשַׁע לוֹ זְרֹעוֹ וְצִדְקָתוֹ הִיא סְמָכָתְהוּ ׃"
1641,17,"וַיִּלְבַּשׁ צְדָקָה כַּשִּׁרְיָן וְכוֹבַע יְשׁוּעָה בְּרֹאשׁוֹ וַיִּלְבַּשׁ בִּגְדֵי נָקָם תִּלְבֹּשֶׁת וַיַּעַט כַּמְעִיל קִנְאָה ׃"
1641,18,"כְּעַל גְּמֻלוֹת כְּעַל יְשַׁלֵּם חֵמָה לְצָרָיו גְּמוּל לְאֹיְבָיו לָאִיִּים גְּמוּל יְשַׁלֵּם ׃"
1641,19,"וְיִירְאוּ מִמַּעֲרָב אֶת־שֵׁם יְהוָה וּמִמִּזְרַח־שֶׁמֶשׁ אֶת־כְּבוֹדוֹ כִּי־יָבוֹא כַנָּהָר צָר רוּחַ יְהוָה נֹסְסָה בוֹ ׃"
1641,20,"וּבָא לְצִיּוֹן גּוֹאֵל וּלְשָׁבֵי פֶשַׁע בְּיַעֲקֹב נְאֻם יְהוָה ׃"
